{"id":1,"ts":"2026-06-11T18:48:16Z","desc":"baseline: unmodified tree, oltp PROFILE=1 MYSQL=1","decision":"keep","metrics":{"qps":4966.02,"tps":248.31,"p95_ms":4.74},"asi":{"mysql_qps":46805.10,"mysql_tps":2340.26,"mysql_p95_ms":0.50,"gap":"vitess at 10.6% of mysql qps; single-threaded so latency-bound: ~4.3ms overhead per 20-query transaction","run_dir":"benchmarks/runs/oltp/20260611-184816-auto-baseline"}}
{"id":2,"ts":"2026-06-11T19:22:34Z","desc":"parallel multi-shard commit in TxConn.commitNormal (was serial per shard)","decision":"discard","metrics":{"qps":4977.40,"tps":248.87,"p95_ms":4.74},"asi":{"second_run":"qps=4898.10 tps=244.92 p95=4.82","conclusion":"no gain vs baseline mean ~5094; expected +5% from removing 1 serial commit RTT but goroutine spawn+handoff on GOMAXPROCS=2 likely eats the savings. Commit RPCs also not counted in VttabletCall histogram so commit cost per txn may be smaller than assumed.","theory_formed":"systemic tax is Go netpoll/scheduler wakeup latency (~10-20us) occurring ~6x per query across vtgate+tablet; explains tablet mysql layer 64us vs 24us raw, and grpc hop 95us vs 40us net floor","next":"test wakeup-latency theory with env-gated scheduler spinner goroutine"}}
{"id":3,"ts":"2026-06-11T19:28:07Z","desc":"scheduler spinner goroutine (for{Gosched()}) in servenv, env-gated VT_SCHED_SPIN, enabled on vtgate+tablets","decision":"discard","metrics":{"qps":662.71,"tps":33.15,"p95_ms":42.61},"asi":{"conclusion":"8x WORSE. Busy-spin exhausts docker CFS quota (cpu.max 200000/100000) -> multi-ms throttle pauses (p95 42ms). NEVER busy-spin under cgroup cpu limits.","still_open":"wakeup-latency theory unconfirmed (test confounded by throttling)","next":"isolate go/mysql client overhead vs raw C client with a minimal Go binary inside the container"}}
{"id":4,"ts":"2026-06-11T19:40:00Z","desc":"diagnostic: go/mysql client tight-loop in idle process inside mysql-1001 container","decision":"keep","metrics":{"client_mean_us":12.6,"client_p99_us":29.0},"asi":{"conclusion":"go/mysql client is fast (12.6us vs C client 10.3us). The 64us seen in busy vttablet = ~50us scheduler/wakeup tax. No CFS throttling under normal load. Attack handoffs/wakeups, not client code.","tool":".auto/diag_mysqlbench/main.go, cross-compile GOOS=linux GOARCH=arm64 CGO_ENABLED=0, docker cp into mysql container"}}
{"id":5,"ts":"2026-06-11T19:57:24Z","desc":"grpc.NumStreamWorkers(GOMAXPROCS) on servenv grpc server (vtgate+vttablet) - reuse stream worker goroutines instead of per-RPC spawn","decision":"keep","metrics":{"qps":5288.65,"tps":264.44,"p95_ms":4.33},"asi":{"ab":"vanilla median-of-3 4953 (4932-4991) vs exp 5288 (5265-5316), +6.8% qps, p95 4.65->4.33","protocol_change":"measure.sh now BENCH_REPEAT=3 within one cluster + median; within-cluster spread ~1%, cluster-to-cluster ±4-5%","upstream":"clean 1-line change, good upstream candidate"}}
{"id":6,"ts":"2026-06-11T20:11:24Z","desc":"GOGC=200 + drop GOMEMLIMIT=1GiB (was GOGC=off) on vtgate+tablets","decision":"keep","metrics":{"qps":5424.10,"tps":271.21,"p95_ms":4.33},"asi":{"ab":"two independent clusters: 5417 (5279-5445) and 5424 (5398-5424) vs exp5 5288. +2.5%","why":"GOGC=off+memlimit causes rare full-1GiB GC cycles with assist storms (10-50ms histogram outliers); GOGC=200 does small frequent cycles","note":"env-only change in benchmarks compose files"}}
{"id":7,"ts":"2026-06-11T20:27:04Z","desc":"bidi-stream Execute pipe: queryservice.QueryPipe/ExecutePipe grpc service + client pipe pool in grpctabletconn, replaces per-query unary Execute","decision":"keep","metrics":{"qps":5747.19,"tps":287.37,"p95_ms":4.03},"asi":{"ab":"5741 (5724-5760) and 5747 (5723-5750) across two clusters vs 5424 prior best: +5.9%, p95 4.33->4.03","design":"one in-flight request per pipe, pool for concurrency, error terminates pipe w/ full grpc status, Unimplemented->permanent unary fallback, ctx enforced via context.AfterFunc cancel","caveat":"per-call grpc-timeout no longer propagated to tablet (tablet's own query timeout still applies); errors cost a stream re-setup","validation":"tabletconntest conformance suite passes through pipe path; 0 sysbench errors","next":"extend pipe to BeginExecute/Commit (4 of ~22 calls/txn)"}}
{"id":8,"ts":"2026-06-11T20:41:18Z","desc":"extend pipe to BeginExecute + Commit (generic pipeHandler + per-method pools)","decision":"discard","metrics":{"qps":5664.04,"tps":283.21,"p95_ms":4.18},"asi":{"ab":"5826 + 5664 (mean 5745) vs exp7 5741 + 5747 (mean 5744): dead even","why_no_gain":"only ~4 of 24 RPCs/txn; BeginExecute already piggybacks begin onto first query; commit RTT partially overlaps txn end","learning":"pipe wins scale with call volume; Execute (~18/24 calls) was the whole prize","code_note":"generic version preserved in git history at commit before this revert if ever needed"}}
{"id":9,"ts":"2026-06-11T21:11:29Z","desc":"fastquery: raw length-prefixed TCP transport for Execute (vtgate->vttablet), env-gated VT_FASTQUERY, port=grpc+1, in-band vtrpc errors, fallback to grpc pipe","decision":"keep","metrics":{"qps":7167.46,"tps":358.38,"p95_ms":3.30},"asi":{"ab":"7167 (7048-7392) + 6344 (6133-6990) across two clusters vs grpc-pipe best 5747: +17-25%","why_it_works":"raw TCP echo floor between containers is 5-12us vs grpc hop ~95us; fastquery removes HTTP/2 framing + ALL goroutine handoffs (caller writes from own goroutine, netpoll wakes caller directly)","validation":"4 unit tests (roundtrip, app error keeps conn, ctx cancel, dial failure); 0 sysbench errors all samples","caveats":"no TLS/auth (gated off by default); ctx deadline not propagated to tablet (server uses context.Background); Execute only","next":"re-profile to find new bottleneck distribution"}}
{"id":10,"ts":"2026-06-11T21:20:43Z","desc":"fastquery: add BeginExecute + Commit methods (generic Pool.Call, method tags 2/3)","decision":"keep","metrics":{"qps":8302.73,"tps":415.15,"p95_ms":2.91},"asi":{"ab":"8303 (8071-8313, tight) vs exp9 7167: +15.8%","lesson":"exp8 (begin/commit via grpc pipe) gained nothing when Execute was also grpc; now that Execute is on raw TCP, the 2x ~95us grpc commits per txn were 7%+ of txn time - relative weights shift as you optimize, revisit discarded ideas","validation":"0 sysbench errors, unit tests + tabletconntest pass"}}
{"id":11,"ts":"2026-06-11T21:43:15Z","desc":"fastquery custom sqltypes.Result wire codec (skip ResultToProto3/MarshalVT/UnmarshalVT/Proto3ToResult layers for Execute)","decision":"keep","metrics":{"qps":8260.43,"tps":413.03,"p95_ms":2.86},"asi":{"ab":"8260 vs exp10 8303: FLAT within noise, p95 2.91->2.86","mechanism_confirmed":"vtgate allocs 9GB->8GB; per-row UnmarshalVT allocs (28% of heap) replaced by 1 buffer + 2 slice allocs per query; decode is 3 allocs total regardless of row count","why_flat":"alloc CPU was not the dominant critical-path cost; syscall+wakeup wall time still rules","kept_because":"strictly simpler data flow (Result straight through, no proto detour), lower GC pressure, prerequisite for future row pass-through (mysql text rows could flow tablet->vtgate->client nearly verbatim)","validation":"codec roundtrip vs proto-path equivalence tests + truncation fuzz, 0 sysbench errors"}}
{"id":12,"ts":"2026-06-11T21:50:28Z","desc":"GOGC=800 (from 200) after alloc reduction","decision":"discard","metrics":{"qps":8338.35,"tps":416.93,"p95_ms":2.81},"asi":{"ab":"8338 vs 8260/8303: +1%, within noise","risk":"GOGC=800 without memlimit can balloon heap toward the 1GB container limit -> OOM risk; not worth an unprovable 1%"}}
{"id":13,"ts":"2026-06-11T22:03:39Z","desc":"bounded spin-read (50us non-blocking busy-poll before parking) in fastquery client","decision":"discard","metrics":{"qps":7155.43,"tps":357.78,"p95_ms":3.36},"asi":{"ab":"7155 vs 8260: -13% WORSE","why":"each non-blocking syscall.Read is a full syscall (~1-3us under docker seccomp); spinning 50us = 20-50 wasted syscalls per call, far more expensive than the one ~10-20us futex wakeup it avoids","learning":"in containers, syscalls are the expensive unit, not wakeups; never busy-poll with syscalls. Wakeup tax must be attacked by REMOVING blocking points (pipelining), not cheaper waiting"}}
{"id":14,"ts":"2026-06-11T22:11:30Z","desc":"retry parallel multi-shard commit (exp2) now that commits ride fastquery","decision":"discard","metrics":{"qps":8295.31,"tps":414.78,"p95_ms":2.86},"asi":{"ab":"8295 vs 8260/8303: flat","why":"goroutine spawn+WaitGroup+handoff (~15us) on GOMAXPROCS=2 cancels the ~60us saved serial RPC; net effect ~1-2%, below noise","learning":"on small-GOMAXPROCS runtimes, parallelism via goroutines only pays when the parallelized work is >>15us; pipelining on ONE goroutine (send both, then read both) would avoid the spawn cost entirely - see ideas.md"}}
{"id":15,"ts":"2026-06-11T22:35:00Z","desc":"final verification: full MYSQL=1 comparison on current HEAD","decision":"keep","metrics":{"qps":8294.00,"tps":414.72,"p95_ms":2.86},"asi":{"vs_mysql":"-82.3% (was -89.4% at baseline); mysql itself stable (46894 vs 46805) so gains are real","cumulative":"+67% qps, -40% p95 across exps 5,6,7,9,10,11","run_dir":"benchmarks/runs/oltp/*-auto-final"}}
{"id":16,"ts":"2026-06-12T08:46:00Z","desc":"BEGIN pipelining: defer begin stmt, pipeline ahead of first statement via mysql protocol pipelining (ExecuteFetchPreceded), env-gated VT_FASTQUERY","decision":"discard","metrics":{"qps":7228.05,"tps":361.41,"p95_ms":3.36},"asi":{"ab":"paired alternation under noisy host (load 6+): exp16 7484+7228 (mean 7356) vs control 7357: dead even","why_no_gain":"the begin mysqld round trip is cheaper than modeled (~10-20us not 50us); 2/txn saves ~2%, below detection","semantics_cost":"begin errors surface at first statement instead of Begin time (5 txpool tests pin old behavior)","implementation_notes":"mysql protocol pipelining works: two COM_QUERYs before reading; MUST reset c.sequence=1 between reading the two responses (per-command sequence cycles); fakesqldb handles pipelined input fine","retest_if":"host quiet AND after other mysqld-RT reductions shift relative weights (exp10 lesson)","absolute_numbers_warning":"today's host is loaded; 7300-7500 today == 8300 last night. NEVER compare across days, always pair"}}
{"id": 17, "ts": "2026-06-12T09:06:00Z", "desc": "EVALUATION: connectrpc (connectrpc.com/connect v1.20.0) as Execute transport - Connect protocol unary POST over tablet HTTP port, codegen-free generic API, vtproto codec", "decision": "discard", "metrics": {"qps": 3734.64, "tps": 186.74, "p95_ms": 6.43}, "asi": {"ab": "connectrpc 3735 vs fastquery control 7357 (same-day, loaded host): -49%. p95 6.43 vs 3.13. Slower than even the grpc unary path it might have replaced", "evidence": "vtgate CPU profile: 29% of total CPU inside connect.CallUnary (net/http persistConn write/readLoop handoffs, HTTP/1.1 header parse/serialize per request, request/header allocations); fastquery transport CPU is near zero by comparison", "verdict": "connectrpc is built on net/http whose per-request floor (~50us+ CPU + 2 goroutine handoffs each side) makes it structurally unsuited for this per-query latency-bound hop; fine for management RPCs, not for the query path", "not_tried": "h2c/WithGRPC() variants - they share the same net/http foundation, would not close a 2x gap", "code": "implementation was reverted uncommitted; key recipe: connect.NewUnaryHandler/NewClient generic API needs no codegen, custom Codec with MarshalVT/UnmarshalVT fast paths, mount on servenv HTTPHandle, client via http.Transport with MaxIdleConnsPerHost"}}
